{
  "schema": "fcmo-corpus-guard-report-v1",
  "verdict": "CARRY_FORWARD",
  "exit_code": 0,
  "checked_at": "2026-09-26T20:00:00Z",
  "max_missing_ratio": 0.2,
  "ratio": 0.0227,
  "published": {
    "release_id": "newswire-925e1ca37c00649e54180549",
    "count": 44
  },
  "candidate": {
    "release_id": "newswire-20c466f170839ac07e07bb80",
    "count": 43
  },
  "missing": [
    "FCMO-FDBE3D996243"
  ],
  "carried": [
    "FCMO-FDBE3D996243"
  ],
  "withdrawn": [],
  "added": [],
  "suppressed": [],
  "alerts": [
    "CORPUS_CARRY_FORWARD"
  ]
}
